{
 "format": "ugoku-direction/1",
 "work": "shonen-rooftop",
 "reading": "rtl",
 "pages": [
  {
   "page": "p01",
   "image": "p01.png",
   "w": 850,
   "h": 1200,
   "story": "At sunset a boy with a scarf stands on a rooftop and says the rooftops are his road (P1). He vows \"I'll deliver it, no matter what!\" (P2). A masked man in a long coat blocks his way, saying \"You won't pass here, kid.\" (P3). The boy crouches low on the roof tiles to brace himself (P4), then dashes forward with a big \"ダッ!!\" (P5).",
   "total_s": 10.3,
   "must": [
    {
     "item": "P5 ダッ!! SFX split into U14, U16, U15 and U13",
     "how": "Treat the four pieces as one SFX, ダッ!!, and animate them together with an impact preset."
    },
    {
     "item": "P4 empty speech balloon at the left",
     "how": "It is a blank (silent) balloon added as manpu. Show it with a pop and do not put text in it."
    }
   ],
   "panels": [
    {
     "id": "p01-p1",
     "order": 1,
     "rect": [
      0.04353,
      0.03083,
      0.91294,
      0.26
     ],
     "type": "h3_full",
     "role": "support",
     "content": "Wide sunset rooftop view with water tanks and antennas; the boy stands at the ledge with his scarf blowing behind him, looking off to the right.",
     "reason": "The drawn flapping scarf is natural motion, and a small head turn adds quiet resolve to the opening shot. The narration fades in over a moving character, not a frozen one. The sky and city stay still.",
     "timing_s": [
      0.0,
      2.4
     ],
     "action": "The boy at the ledge starts nearly still, turns his head slightly further to the right as both ends of his scarf flap to the left behind him, then returns to the starting pose.",
     "magnitude": "medium",
     "mode": "fl",
     "emotion_source": "Narration 日没の街。屋根の上がおれの道だ。 and the drawn scarf ends flapping to the left",
     "seed": 74750
    },
    {
     "id": "p01-p2",
     "order": 2,
     "rect": [
      0.50471,
      0.2975,
      0.45176,
      0.3325
     ],
     "type": "h3_full",
     "role": "support",
     "content": "Close-up of the boy facing forward, his right fist raised and clenched near his chest.",
     "reason": "A close-up vow: squeezing the clenched fist turns his determination into a visible gesture that matches the balloon.",
     "timing_s": [
      1.8,
      4.2
     ],
     "action": "The boy starts nearly still, tightens the raised fist on screen-right and pulls it slightly closer to his chest while his gaze hardens, then returns to the starting pose.",
     "magnitude": "medium",
     "mode": "fl",
     "emotion_source": "Line 届けるぞ、必ず！ with the stern stare and the clenched fist",
     "seed": 214
    },
    {
     "id": "p01-p3",
     "order": 3,
     "rect": [
      0.04353,
      0.29167,
      0.45176,
      0.33833
     ],
     "type": "h3_full",
     "role": "support",
     "content": "Low-angle shot of a masked man in a long coat, arms crossed, standing on a rooftop structure.",
     "reason": "The threat lands harder if the blocker leans in while he speaks. The coat hem is already drawn flaring. The balloon animates, so the figure has to move too.",
     "timing_s": [
      3.6,
      6.0
     ],
     "action": "The masked man starts nearly still, leans his upper body slightly forward with his arms still crossed as the hem of his long coat sways out to the left, then returns to the starting pose.",
     "magnitude": "medium",
     "mode": "fl",
     "emotion_source": "Line ここは通さんぞ、小僧。 with the low-angle pose and the drawn flaring coat hem",
     "seed": 78161
    },
    {
     "id": "p01-p4",
     "order": 4,
     "rect": [
      0.59412,
      0.63667,
      0.36235,
      0.3325
     ],
     "type": "h3_full",
     "role": "support",
     "content": "The boy crouches low on the roof tiles with one hand on the tiles, bracing his legs to spring.",
     "reason": "This is the wind-up before the dash. Visibly gathering strength builds tension and matches the animated グッ and the emphasis marks.",
     "timing_s": [
      5.4,
      7.8
     ],
     "action": "The crouching boy starts nearly still, sinks his hips lower and presses the hand on the roof tiles at the bottom center harder against them, while the hand near his face on screen-left tightens and his shoulders tense, then returns to the starting pose.",
     "magnitude": "medium",
     "mode": "fl",
     "emotion_source": "SFX グッ and the emphasis marks near his face",
     "seed": 65263
    },
    {
     "id": "p01-p5",
     "order": 5,
     "rect": [
      0.04353,
      0.63667,
      0.54,
      0.3325
     ],
     "type": "h3_full",
     "role": "lead",
     "content": "The boy runs to the left across the roof tiles, both fists pumping and his scarf streaming behind him.",
     "reason": "The page's climax: a one-way dash with drawn speed lines. It is a run, so it must not reverse, which means mode f.",
     "timing_s": [
      7.2,
      9.9
     ],
     "poly": [
      [
       0.04470588235294118,
       0.6375
      ],
      [
       0.04470588235294118,
       0.9675
      ],
      [
       0.5164705882352941,
       0.9683333333333334
      ],
      [
       0.5023529411764706,
       0.9375
      ],
      [
       0.45529411764705885,
       0.9391666666666667
      ],
      [
       0.5023529411764706,
       0.9325
      ],
      [
       0.5188235294117647,
       0.8941666666666667
      ],
      [
       0.4682352941176471,
       0.9091666666666667
      ],
      [
       0.5658823529411765,
       0.8475
      ],
      [
       0.5823529411764706,
       0.8766666666666667
      ],
      [
       0.5823529411764706,
       0.6375
      ]
     ],
     "action": "The boy runs to the left across the roof tiles, pumping both fists and pushing off with his legs, while his scarf streams back to the right behind him. He keeps moving forward to the left the whole time.",
     "magnitude": "large",
     "mode": "f",
     "emotion_source": "SFX ダッ!! and the drawn speed lines at the upper right with the streaming scarf",
     "seed": 83945
    }
   ],
   "bubbles": [
    {
     "id": "p01-b1",
     "unit": "U3",
     "panel": "p01-p1",
     "rect": [
      0.76471,
      0.07417,
      0.15765,
      0.17167
     ],
     "text": "日没の街。屋根の上がおれの道だ。",
     "order": 1,
     "t_in": 0.6,
     "anim": "fade"
    },
    {
     "id": "p01-b2",
     "unit": "U2",
     "panel": "p01-p2",
     "rect": [
      0.52,
      0.3,
      0.15176,
      0.19333
     ],
     "text": "届けるぞ、必ず！",
     "order": 2,
     "t_in": 2.4,
     "anim": "pop"
    },
    {
     "id": "p01-b3",
     "unit": "U1",
     "panel": "p01-p3",
     "rect": [
      0.29529,
      0.28917,
      0.19765,
      0.19167
     ],
     "text": "ここは通さんぞ、小僧。",
     "order": 3,
     "t_in": 4.2,
     "anim": "pop"
    },
    {
     "id": "p01-b4",
     "unit": "A2",
     "panel": "p01-p4",
     "rect": [
      0.6,
      0.73,
      0.06,
      0.07
     ],
     "text": "",
     "order": 4,
     "t_in": 6.0,
     "anim": "pop"
    }
   ],
   "fx": [
    {
     "id": "p01-f1",
     "unit": "U11",
     "panel": "p01-p4",
     "rect": [
      0.64588,
      0.64667,
      0.10706,
      0.06083
     ],
     "text": "グッ",
     "kind": "sfx",
     "preset": "tremble",
     "t_in": 5.7
    },
    {
     "id": "p01-f2",
     "unit": "A1",
     "panel": "p01-p4",
     "rect": [
      0.66,
      0.71,
      0.08,
      0.06
     ],
     "text": "",
     "kind": "manpu",
     "preset": "jolt",
     "t_in": 6.1
    },
    {
     "id": "p01-f3",
     "unit": "U13",
     "panel": "p01-p5",
     "rect": [
      0.32471,
      0.84417,
      0.29765,
      0.12583
     ],
     "text": "!!",
     "kind": "sfx",
     "preset": "impact",
     "t_in": 7.5
    },
    {
     "id": "p01-f4",
     "unit": "U14",
     "panel": "p01-p5",
     "rect": [
      0.11059,
      0.8475,
      0.08588,
      0.02917
     ],
     "text": "ダ",
     "kind": "sfx",
     "preset": "impact",
     "t_in": 7.9
    },
    {
     "id": "p01-f5",
     "unit": "U15",
     "panel": "p01-p5",
     "rect": [
      0.20353,
      0.85667,
      0.14588,
      0.07917
     ],
     "text": "ッ",
     "kind": "sfx",
     "preset": "impact",
     "t_in": 8.3
    },
    {
     "id": "p01-f6",
     "unit": "U16",
     "panel": "p01-p5",
     "rect": [
      0.10824,
      0.885,
      0.04353,
      0.0275
     ],
     "text": "ダ",
     "kind": "sfx",
     "preset": "impact",
     "t_in": 8.7
    },
    {
     "id": "p01-f7",
     "unit": "A3",
     "panel": "p01-p5",
     "rect": [
      0.43,
      0.66,
      0.15,
      0.13
     ],
     "text": "",
     "kind": "manpu",
     "preset": "line_stretch",
     "t_in": 9.1
    }
   ]
  },
  {
   "page": "p02",
   "image": "p02.png",
   "w": 850,
   "h": 1200,
   "story": "The boy leaps at the masked brute shouting \"くらえっ!\" and their fists meet with a huge \"トンッ!!\". The brute throws another punch and groans \"ぬうっ!?\", but the boy dodges with \"遅いっ!\". The brute's cracked mask shows his shock (\"なん…だと?\") as the grinning boy skids to a landing on the rooftop edge with \"ザザッ\".",
   "total_s": 10.0,
   "must": [
    {
     "item": "P1 SFX トンッ!!",
     "how": "The big impact SFX spans the whole panel in several pieces: U16 (トンッ) plus U17 and U20 (the two !). U22 sits on the ト stroke and is marked noise so it is not counted twice. Animate U16, U17 and U20 together as one impact."
    }
   ],
   "panels": [
    {
     "id": "p02-p1",
     "order": 1,
     "rect": [
      0.04353,
      0.03083,
      0.91294,
      0.37583
     ],
     "type": "h3_full",
     "role": "lead",
     "content": "The boy leaps in from the left and punches; his fist hits the masked brute's fist on the right, with debris flying and radial speed lines.",
     "reason": "This is the main clash of the page. The impact is drawn, so the attack and the recoil play out one way in the same panel.",
     "timing_s": [
      0.0,
      2.4
     ],
     "poly": [
      [